{
  "lock_version": "0.1.0",
  "core": {
    "path": "examples/runscope/runscope.raid.json",
    "schema_version": "0.1.0",
    "ir_hash": "sha256:e90d2748a84c23b67b951f4eb5a8dc279d465822ee1a782343394cc55f395b58",
    "hash_algorithm": "sha256"
  },
  "resolver": {
    "name": "dslraid",
    "version": "0.1.0"
  },
  "resolved_refs": [
    {
      "subject": "fsm:runtime",
      "kind": "fsm",
      "definition_hash": "sha256:0000000000000000000000000000000000000000000000000000000000000002"
    }
  ],
  "derivations": [
    {
      "derivation": "derivation:runtime.codegen",
      "rule": "fsm_codegen",
      "generator": {
        "name": "dslraid-codegen",
        "version": "0.1.0"
      },
      "input_hash": "sha256:e90d2748a84c23b67b951f4eb5a8dc279d465822ee1a782343394cc55f395b58",
      "targets": [
        "artifact:runtime_fsm.go",
        "artifact:runtime_fsm.rs",
        "artifact:fsm_runtime_running_golden"
      ]
    },
    {
      "derivation": "derivation:runscope.doc",
      "rule": "markdown_doc",
      "generator": {
        "name": "dslraid-doc",
        "version": "0.1.0"
      },
      "input_hash": "sha256:e90d2748a84c23b67b951f4eb5a8dc279d465822ee1a782343394cc55f395b58",
      "targets": [
        "artifact:runscope_generated_md"
      ]
    }
  ],
  "artifacts": [
    {
      "artifact": "artifact:runtime_fsm.go",
      "path": "generated/runtime_fsm.go",
      "kind": "generated",
      "generated_by": "derivation:runtime.codegen",
      "input_hash": "sha256:e90d2748a84c23b67b951f4eb5a8dc279d465822ee1a782343394cc55f395b58",
      "content_hash": "sha256:8022f4c84de1e3fa19af41727d91c67709ae41170ed616330d5972c9c9a4811a",
      "schema_version": "0.1.0",
      "status": "fresh"
    },
    {
      "artifact": "artifact:runtime_fsm.rs",
      "path": "generated/runtime_fsm.rs",
      "kind": "generated",
      "generated_by": "derivation:runtime.codegen",
      "input_hash": "sha256:e90d2748a84c23b67b951f4eb5a8dc279d465822ee1a782343394cc55f395b58",
      "content_hash": "sha256:d575be2d1aabd2fd8c5e2552fcc0e600bf884882920bd890b503890676861ffa",
      "schema_version": "0.1.0",
      "status": "fresh"
    },
    {
      "artifact": "artifact:fsm_runtime_running_golden",
      "path": "tests/golden/fsm-runtime-running.golden",
      "kind": "test",
      "generated_by": "derivation:runtime.codegen",
      "input_hash": "sha256:e90d2748a84c23b67b951f4eb5a8dc279d465822ee1a782343394cc55f395b58",
      "content_hash": "sha256:aae50d9643c765684ad0bb9e500229e904966e468c926422137f7067c09a6618",
      "schema_version": "0.1.0",
      "status": "fresh"
    },
    {
      "artifact": "artifact:runscope_generated_md",
      "path": "examples/runscope/runscope.generated.md",
      "kind": "doc",
      "generated_by": "derivation:runscope.doc",
      "input_hash": "sha256:e90d2748a84c23b67b951f4eb5a8dc279d465822ee1a782343394cc55f395b58",
      "content_hash": "sha256:284167605fab1d05f9e5b1eb57a8318600603170faa668420cd176b46ba60ea2",
      "schema_version": "0.1.0",
      "status": "fresh"
    }
  ],
  "golden": [],
  "compat": [
    {
      "subject": "fsm:runtime",
      "requires": "runtime supports start and completion observation",
      "satisfied_by": "capability:runtime_execution",
      "status": "ok"
    }
  ]
}
